{
  "schema_version": "2.0",
  "world_id": "T1-HW-20260729-C",
  "evaluation_step": 4,
  "method_id": "MANUAL-HWC-ORACLE-CALIBRATION-NOT-A-CANDIDATE",
  "decisions": [
    {
      "detection_id": "CAL-C-PAIR-001",
      "kind": "PAIR",
      "state": "DISCOVERED",
      "seeker": "CEDAR-72",
      "provider": "DUNE-18",
      "direction": "SEEK_TO_OFFER",
      "evidence_refs": ["W-HWC-SPECTRAL-SEEK-V3", "W-HWC-SPECTRAL-OFFER-V9"]
    },
    {
      "detection_id": "CAL-C-PAIR-002",
      "kind": "PAIR",
      "state": "INVALIDATED",
      "seeker": "EMBER-45",
      "provider": "FALLOW-26",
      "direction": "SEEK_TO_OFFER",
      "evidence_refs": ["W-HWC-SPORE-SEEK-V8", "W-HWC-SPORE-OFFER-V2", "W-HWC-SPORE-FLIP-V3"]
    },
    {
      "detection_id": "CAL-C-PAIR-003",
      "kind": "PAIR",
      "state": "DISCOVERED",
      "seeker": "GROVE-61",
      "provider": "HOLLOW-34",
      "direction": "SEEK_TO_OFFER",
      "evidence_refs": ["W-HWC-GROVE-PROJECTION", "W-HWC-HOLLOW-PROJECTION"]
    },
    {
      "detection_id": "CAL-C-PAIR-004",
      "kind": "PAIR",
      "state": "DISCOVERED",
      "seeker": "ISLET-53",
      "provider": "JUNCTION-88",
      "direction": "SEEK_TO_OFFER",
      "evidence_refs": ["W-HWC-ISLET-RECIP-AUTH", "W-HWC-JUNCTION-RECIP-AUTH"]
    },
    {
      "detection_id": "CAL-C-PAIR-005",
      "kind": "PAIR",
      "state": "UNFINDABLE_UNDER_POLICY",
      "seeker": "KARST-11",
      "provider": "LAGOON-97",
      "direction": "SEEK_TO_OFFER",
      "evidence_refs": ["W-HWC-PEAT-SEEK-V4", "W-HWC-PEAT-POLICY-REFUSAL"]
    },
    {
      "detection_id": "CAL-C-CLAIM-001",
      "kind": "CLAIM",
      "state": "UNKNOWN",
      "claim_key": "capability:drift-window:avian-contamination-survey",
      "subject": "MORAIN-20",
      "evidence_refs": ["W-HWC-NO-RESPONSE"]
    },
    {
      "detection_id": "CAL-C-CLAIM-002",
      "kind": "CLAIM",
      "state": "REFUSE",
      "claim_key": "capability:sealed:lichen-spore-culture",
      "subject": "NARROW-63",
      "evidence_refs": ["W-HWC-EXPLICIT-REFUSAL"]
    },
    {
      "detection_id": "CAL-C-CLAIM-003",
      "kind": "CLAIM",
      "state": "ABSENT",
      "claim_key": "capability:closed:subsea-alkalinity-cassette",
      "subject": "POP-SUBSEA-ALKALINITY",
      "evidence_refs": ["W-HWC-CLOSED-POP-V2", "W-HWC-CLOSED-ORBIT-NEG", "W-HWC-CLOSED-PINNACLE-NEG", "W-HWC-CLOSED-QUARRY-NEG"]
    }
  ],
  "projection_updates": [
    {
      "party": "FALLOW-26",
      "invalidated_signature": "SIG-HWC-SPORE-OFFER-V2",
      "from_version": 2,
      "to_version": 3,
      "step": 4,
      "current_direction": "SEEK",
      "evidence_ref": "W-HWC-SPORE-FLIP-V3"
    }
  ],
  "execution_proofs": [
    {
      "action_id": "ACT-HWC-RELAY-01",
      "detection_id": "CAL-C-PAIR-003",
      "action_kind": "DERIVED_ONWARD",
      "status": "EXECUTED_VERIFIED",
      "action_digest": "cfc9e6da7f9c77be5b49ee73e4ed7d18e473af21215b76d0a9504625f1339a52",
      "idempotency_key": "HWC-CANOPY-ROUTE-01",
      "delivery_events": [
        {
          "event_ref": "EV-HWC-GROVE-HUB-001",
          "origin_party": "GROVE-61",
          "sender": "GROVE-61",
          "recipient": "HUB-MOSS",
          "fact_id": "F-HWC-GROVE-CANOPY-PROJECTION",
          "depth": 0,
          "purpose": "canopy-counterpart-screen",
          "retention": "PT4M"
        },
        {
          "event_ref": "EV-HWC-HOLLOW-REED-001",
          "origin_party": "HOLLOW-34",
          "sender": "HOLLOW-34",
          "recipient": "NODE-REED",
          "fact_id": "F-HWC-HOLLOW-CANOPY-PROJECTION",
          "depth": 0,
          "purpose": "canopy-counterpart-screen",
          "retention": "PT4M"
        },
        {
          "event_ref": "EV-HWC-HOLLOW-HUB-002",
          "origin_party": "HOLLOW-34",
          "sender": "NODE-REED",
          "recipient": "HUB-MOSS",
          "fact_id": "F-HWC-HOLLOW-CANOPY-PROJECTION",
          "depth": 1,
          "purpose": "canopy-counterpart-screen",
          "retention": "PT4M"
        }
      ],
      "controller_receipt_ref": "CR-HWC-RELAY-0007",
      "recipient_ack_refs": ["ACK-HWC-HUB-MOSS-0042", "ACK-HWC-NODE-REED-0014"],
      "external_anchor_ref": "ANCHOR-HWC-000091"
    },
    {
      "action_id": "ACT-HWC-RECIP-01",
      "detection_id": "CAL-C-PAIR-004",
      "action_kind": "RECIPROCAL_EXCHANGE",
      "status": "EXECUTED_VERIFIED",
      "action_digest": "41541744bed90978fcfad37a872dbf65344fb33d7bcd41e7a03bf7c418589619",
      "idempotency_key": "HWC-TIDAL-RECIP-01",
      "delivery_events": [
        {
          "event_ref": "EV-HWC-ISLET-TO-JUNCTION-001",
          "origin_party": "ISLET-53",
          "sender": "ISLET-53",
          "recipient": "JUNCTION-88",
          "fact_id": "F-HWC-ISLET-RECIP-PROJECTION",
          "depth": 0,
          "purpose": "symmetric-tidal-probe",
          "retention": "PT6M"
        },
        {
          "event_ref": "EV-HWC-JUNCTION-TO-ISLET-001",
          "origin_party": "JUNCTION-88",
          "sender": "JUNCTION-88",
          "recipient": "ISLET-53",
          "fact_id": "F-HWC-JUNCTION-RECIP-PROJECTION",
          "depth": 0,
          "purpose": "symmetric-tidal-probe",
          "retention": "PT6M"
        }
      ],
      "controller_receipt_ref": "CR-HWC-RECIP-0011",
      "recipient_ack_refs": ["ACK-HWC-ISLET-0028", "ACK-HWC-JUNCTION-0033"],
      "external_anchor_ref": "ANCHOR-HWC-000092"
    }
  ],
  "relation_handoffs": [
    {
      "detection_id": "CAL-C-PAIR-001",
      "status": "CANDIDATE_NOT_COMMITMENT",
      "commitment": false,
      "authority_inferred": false,
      "evidence_refs": ["W-HWC-SPECTRAL-SEEK-V3", "W-HWC-SPECTRAL-OFFER-V9"],
      "open_questions": ["authority", "commitment", "feasibility", "acceptance"]
    },
    {
      "detection_id": "CAL-C-PAIR-003",
      "status": "CANDIDATE_NOT_COMMITMENT",
      "commitment": false,
      "authority_inferred": false,
      "evidence_refs": ["CR-HWC-RELAY-0007", "ANCHOR-HWC-000091"],
      "open_questions": ["authority", "commitment", "task outcome"]
    },
    {
      "detection_id": "CAL-C-PAIR-004",
      "status": "CANDIDATE_NOT_COMMITMENT",
      "commitment": false,
      "authority_inferred": false,
      "evidence_refs": ["CR-HWC-RECIP-0011", "ANCHOR-HWC-000092"],
      "open_questions": ["authority", "commitment", "task outcome"]
    }
  ]
}
